{
  "request_id": "boolean_thicken_generated_sheet_001",
  "owner": "kernel-dev",
  "target_api": "api_boolean",
  "sdk_source_refs": [
    "Offset/API.h: api_thicken_body",
    "Boolean/API.h: api_boolean"
  ],
  "test_goal": "Exercise a boolean subtraction whose target body was created by sheet thicken.",
  "risk_summary": "Generated offset/thicken side or cap topology can pass API status but produce invalid or geometrically wrong boolean output.",
  "geometry": {
    "family": "generated_thicken",
    "target_builder": "rect_profile -> thicken",
    "tool_builder": "solid_cylinder",
    "parameter_notes": "Keep sheet thickness comfortably above topology tolerance, then sweep the cutter around side contact."
  },
  "tolerance_focus": [
    "exact_contact",
    "geom_tol",
    "topo_tol",
    "generated_topology"
  ],
  "oracles": [
    "result_bodies",
    "properties",
    "boolean_volume_relation",
    "point_relation",
    "distance",
    "plane_extreme",
    "topocheck"
  ],
  "expected_behavior": "The subtraction should return at least one valid body. Interior sample points and exact coordinate extrema should remain stable across near-contact variants.",
  "case_count": 5,
  "run_profile": "smoke",
  "input_assets": {},
  "notes": "Use stable chain step ids so topo tracking and triage can name generated sheet/thicken topology."
}
