{
  "request_id": "iface_11_iges_roundtrip_imported_sgt",
  "owner": "exchange-dev",
  "target_api": "iges_roundtrip",
  "sdk_source_refs": [
    "SGGK IgesExchange/API.h: api_iges_export",
    "SGGK IgesExchange/API.h: api_iges_import",
    "OCC surrogate: IGESControl_Writer derives precision from shape tolerance"
  ],
  "test_goal": "Roundtrip a selected imported ABC SGT body through IGES and compare source/result properties.",
  "risk_summary": "IGES export precision and shape tolerance settings can lead to successful return codes with measurable geometry drift.",
  "geometry": {
    "family": "exchange_file",
    "input_asset": "artifacts/interface_distillation/02_step_import_abc/top_complex_import/<case>/output/result_1.sgt",
    "parameter_notes": "Exercise default IGES options first; add face-only or SGK specified data variants when source inspection points there."
  },
  "tolerance_focus": [
    "roundtrip_drift",
    "import_topology"
  ],
  "oracles": [
    "roundtrip_comparison",
    "properties",
    "topocheck"
  ],
  "expected_behavior": "IGES roundtrip should preserve source/result property metrics within tolerances or emit a precise drift report.",
  "case_count": 3,
  "run_profile": "smoke",
  "input_assets": {
    "source_file": "artifacts/interface_distillation/02_step_import_abc/top_complex_import/<case>/output/result_1.sgt"
  },
  "notes": "Use flat_recipe unless the model proposes a small matrix over IGES option flags."
}
