{
  "request_id": "iface_03_loaded_sgt_abc_recut_boolean",
  "owner": "boolean-dev",
  "target_api": "api_boolean",
  "sdk_source_refs": [
    "SGGK Boolean/API.h: api_boolean",
    "SGGK topology deserialization for imported ABC SGT bodies"
  ],
  "test_goal": "Use imported ABC SGT outputs as loaded_sgt targets and recut them with generated tools.",
  "risk_summary": "Imported ABC bodies contain realistic complex topology; boolean recut can expose split/imprint/tolerance bugs that primitive-only tests miss.",
  "geometry": {
    "family": "loaded_sgt",
    "target_builder": "loaded_sgt from ABC import artifacts",
    "tool_builder": "solid_cylinder, sweep_circle_line, or extrude_rect generated by corpus recut",
    "input_asset": "artifacts/interface_distillation/02_step_import_abc/top_complex_import",
    "parameter_notes": "Use exact coordinate-plane bbox probing before tool placement; conservative SDK bboxes are diagnostic only."
  },
  "tolerance_focus": [
    "exact_contact",
    "geom_tol",
    "topo_tol",
    "generated_topology",
    "import_topology"
  ],
  "oracles": [
    "result_bodies",
    "properties",
    "distance",
    "plane_extreme",
    "topocheck"
  ],
  "expected_behavior": "Generated recuts should be valid, non-empty when expected, and triaged with original ABC source and target/tool contact candidates.",
  "case_count": 36,
  "run_profile": "corpus",
  "input_assets": {
    "dataset_root": "artifacts/interface_distillation/02_step_import_abc/top_complex_import"
  },
  "notes": "Prefer generate_corpus_recut_matrix.py with --runner and --require-exact-bbox-probe."
}
